{
  "version": "1.0.0",

  "role": {
    "title": "Senior Backend Engineer",
    "level": "Senior",
    "company": "Acme Cloud",
    "company_slug": "acme-cloud",
    "seniority_proportions": {
      "behavioral_pct": 70,
      "situational_pct": 30
    }
  },

  "competencies": [
    { "id": "self_confidence",            "name": "Self-Confidence",            "domain": "intrapersonal", "weight": 0.08 },
    { "id": "achievement_orientation",    "name": "Achievement Orientation",    "domain": "intrapersonal", "weight": 0.08 },
    { "id": "information_seeking",        "name": "Information Seeking",        "domain": "business",      "weight": 0.10 },
    { "id": "analytical_thinking",        "name": "Analytical Thinking",        "domain": "business",      "weight": 0.18 },
    { "id": "conceptual_thinking",        "name": "Conceptual Thinking",        "domain": "business",      "weight": 0.16 },
    { "id": "initiative",                 "name": "Initiative",                 "domain": "business",      "weight": 0.10 },
    { "id": "flexibility",                "name": "Flexibility",                "domain": "business",      "weight": 0.08 },
    { "id": "impact_and_influence",       "name": "Impact and Influence",       "domain": "interpersonal", "weight": 0.08 },
    { "id": "interpersonal_understanding","name": "Interpersonal Understanding","domain": "interpersonal", "weight": 0.06 },
    { "id": "team_leadership",            "name": "Team Leadership",            "domain": "leadership",    "weight": 0.08 }
  ],

  "stages": [
    {
      "id": "screening",
      "duration_minutes": 25,
      "interviewer_persona": {
        "name": "Sarah Chen",
        "role": "Senior Technical Recruiter at Acme Cloud",
        "style": "Warm but efficient. Time-boxed. Friendly opening, then crisp filter questions. Will redirect if the candidate rambles. Not technical — won't go deep on system design."
      },
      "opening_script": "Hi! I'm Sarah, technical recruiter at Acme Cloud. Thanks for taking the time today. This is a 25-minute screening call — I want to get a sense of your background, why you're interested in us, and answer logistical questions. Sound good? Let's start.",
      "closing_script": "Great, that's all I had on my side. If we move forward, the next round is a 60-minute behavioral with the hiring manager. Any final questions for me before we wrap?",
      "questions": [
        {
          "id": "scr_q1_intro",
          "text": "Tell me about yourself and what brings you to look at Acme Cloud right now.",
          "type": "screening",
          "competencies": [
            { "id": "self_confidence", "weight": 0.6 },
            { "id": "achievement_orientation", "weight": 0.4 }
          ],
          "bars_anchors": {
            "1": "Rambling, no clear narrative arc. Cannot articulate why this role or this company. Mentions disliking current job as primary motivation.",
            "3": "Coherent 90-second summary covering current role, relevant background, and a specific reason for interest in Acme Cloud (product, scale, team). Clear delivery, minimal filler.",
            "5": "Tight 60-second pitch with explicit through-line connecting past work to the JD. Names a specific Acme product or technical challenge they want to work on, with evidence they researched the company beyond the careers page."
          },
          "follow_ups": ["What specifically about Acme caught your attention?"]
        },
        {
          "id": "scr_q2_recent_project",
          "text": "Walk me through a project from the last 12 months that you're most proud of. Keep it under 3 minutes.",
          "type": "behavioral",
          "competencies": [
            { "id": "achievement_orientation", "weight": 0.7 },
            { "id": "self_confidence", "weight": 0.3 }
          ],
          "bars_anchors": {
            "1": "Vague description. No metrics. Cannot articulate own contribution vs. team's. Goes well over time and gets cut off.",
            "3": "Concrete project, owns their part, names at least one quantifiable outcome (latency, users, revenue, time saved). Stays roughly within the time box.",
            "5": "Crisp under 3 minutes. STAR-shaped narrative with situation, their specific role, decisions made, and verified impact (numbers, before/after). Highlights a non-obvious technical or judgment call."
          },
          "follow_ups": ["What was your specific contribution vs the team's?", "What would you do differently?"]
        },
        {
          "id": "scr_q3_motivation",
          "text": "Why are you considering leaving your current role?",
          "type": "screening",
          "competencies": [
            { "id": "self_confidence", "weight": 0.5 },
            { "id": "achievement_orientation", "weight": 0.5 }
          ],
          "bars_anchors": {
            "1": "Speaks negatively about current employer, names individuals, complains about compensation as sole reason. Defensive tone.",
            "3": "Professional framing. Names a growth-oriented reason (scope, technology, scale) without trashing current employer.",
            "5": "Forward-looking framing tied to specific career goals. Acknowledges what current role gave them and articulates a specific delta they want at Acme — without bashing anyone."
          },
          "follow_ups": ["What would the new role need to offer that your current one doesn't?"]
        },
        {
          "id": "scr_q4_comp",
          "text": "What are your salary expectations for this role?",
          "type": "screening",
          "competencies": [
            { "id": "self_confidence", "weight": 0.7 },
            { "id": "information_seeking", "weight": 0.3 }
          ],
          "bars_anchors": {
            "1": "Refuses to give any number. Or gives a number wildly out of band with no justification. Or asks the recruiter to make an offer first with no anchor.",
            "3": "Provides a reasonable range with brief justification (market data, current comp). Open to discussion. Asks about total comp structure.",
            "5": "States a specific range anchored to market research, total comp (base + equity + bonus), and acknowledges flexibility based on the full package. Asks intelligent questions about Acme's leveling and equity refresh policy."
          },
          "follow_ups": ["Is that base or total comp?", "How flexible are you?"]
        },
        {
          "id": "scr_q5_questions",
          "text": "What questions do you have for me about the role, the team, or Acme?",
          "type": "screening",
          "competencies": [
            { "id": "information_seeking", "weight": 0.8 },
            { "id": "self_confidence", "weight": 0.2 }
          ],
          "bars_anchors": {
            "1": "No questions, or only asks about things easily found on the careers page (PTO, remote policy, benefits).",
            "3": "Two or three substantive questions about the team, the tech stack, or near-term challenges. Listens to answers.",
            "5": "Targeted questions that show research: references a recent Acme blog post, a specific product line, or a known engineering challenge. Probes for signal on team health, autonomy, and growth path. Builds on the recruiter's answers."
          },
          "follow_ups": []
        }
      ]
    },

    {
      "id": "behavioral",
      "duration_minutes": 60,
      "interviewer_persona": {
        "name": "Marcus Patel",
        "role": "Engineering Manager, Platform Team at Acme Cloud",
        "style": "Calm, structured, takes notes visibly. Uses STAR-style probing: 'what was the situation?', 'what did YOU do?', 'what was the outcome?'. Will gently push back on vague answers and ask for specifics. Not adversarial but thorough."
      },
      "opening_script": "Hey, I'm Marcus, EM for the Platform team here. Sarah passed along a strong note. This hour is about how you operate in real situations — I'll ask five behavioral questions and probe with follow-ups. I'm looking for specific stories, not philosophy. Ready?",
      "closing_script": "Thanks — really appreciated the depth. The next round is a 90-minute technical with two engineers from my team. Any questions for me before we close?",
      "questions": [
        {
          "id": "beh_q1_disagreement",
          "text": "Tell me about a time you disagreed with a tech lead or senior engineer on an architectural decision. Walk me through how you handled it.",
          "type": "behavioral",
          "competencies": [
            { "id": "impact_and_influence", "weight": 0.5 },
            { "id": "interpersonal_understanding", "weight": 0.3 },
            { "id": "self_confidence", "weight": 0.2 }
          ],
          "bars_anchors": {
            "1": "Story is vague or hypothetical. Either rolled over without pushback or escalated immediately without trying to resolve peer-to-peer. No reflection on outcome or learning.",
            "3": "Concrete situation with named technical disagreement. Articulated their position with reasoning and data. Reached a working resolution (could be either direction). Acknowledges what they learned.",
            "5": "Specific, recent story with technical depth. Brought new evidence (benchmarks, prototypes, customer data) to change the conversation. Describes how they preserved the relationship while disagreeing. Names what changed in their own thinking. Identifies when to defer vs. when to push."
          },
          "follow_ups": ["What specifically did you say?", "How did the relationship evolve afterward?", "When would you have backed down?"]
        },
        {
          "id": "beh_q2_changing_reqs",
          "text": "Describe a project where the requirements or scope changed significantly mid-flight. How did you respond?",
          "type": "behavioral",
          "competencies": [
            { "id": "flexibility", "weight": 0.6 },